Timestamp,Aimag,Title (100),Title Korean (100),Description Korean (255),Description (255),About ,About Korean ,Cover (Link),Thumbnail (Link)
1/31/2023 8:39:21,Khovd,Хар-Ус нуур,하르오스 호수 ,"몽골의 큰 호수들 중의 하나이며 크기가 1.153km2, 길이는 72km. 넓이는 26km이다. 호수 가운데에 섬이 하나 있다. 1997년에 하르호수와 두르공 호수를 포함한 850.272ha 땅을 국가보호지역으로 지정하였다. 크지만 비교적 얕은 담수호다. ","1,600 гаруй км зайтай орших Монголын том нууруудын нэг Хар ус нуур нь 1153 ам километр талбайтай, 72 километр урт, 26 километр өргөн, дундаа аралтай, урд захаараа хулс, шагшуургатай нуур юм. Зэгсний гахай зэрэг ховор амьтадтай, цөлжүү хээр, заримдаг цөлийн нуур бөгөөд Хар нуур, Дөргөн нууруудыг оролцуулан 1997 онд улсын тусгай хамгаалалтанд авсан. Их нууруудын хотгорын бүлэг нууруудын дотор далайн төвшнөөс дээш 1157 метр өндөрт орших цэнгэг устай, урсгал нуур юм. Хэдийгээр том талбайтай боловч маш гүехэн нуур бөгөөд хамгийн гүн нь 4.4 метр, дундаж гүн нь 2 метр байдаг. Хар ус нуурт том жижиг 10 гаруй арал байгаагаас хамгийн том нь 400 ам километр талбайтай, 30 орчим километр урт, усны мандлаас 272 метр өндөр Агшаб хэмээх арал бөгөөд тэрээр Хар ус нуурыг хойд урд гэсэн том жижиг хоёр хэсэгт хуваана. Хойд урд нуурыг 1-2 метр гүнтэй, 50-100 метр өргөн, 20 гаруй километр урт Лүн Юм гэдэг нэртэй хоолой холбоно. Хойд нуур нь 400 орчим ам километр талбайтай боловч нилдээ зэгсээр хучигдаж нуур гэхээргүй бага устай болжээ. Хар ус нуур нь 70450 ам километр талбайгаас усжина. Үүний 70% нь ганц Ховд голын сав газарт хамаарна.
Монгол Алтайн нуруунаас эх авч урсах Ховд, Буянт Цэнхэрийн гол жилд барагцаалбал 2.2 шоо километр ус нийлүүлэх бөгөөд илүүдэл усаа ууршуулахын хамт 40 километр урт 50-75 метрийн өргөн Чоно харайхын голоор Хар ус нуурт өгнө. Хар ус нуурын бүс нутагт 12 мянган хүн ам оршин сууж, 642 мянган мал бэлчдэг учраас усны бохирдол, бэлчээрийн даац хэтрэх асуудал гарч байгаа ажээ.  Тийм учраас БОАЖЯ-наас анхаарал тавьж, төрийн захиргааны 12 байгаль хамгаалагчтай хэсэг 2007 оноос ажиллаж эхэлсэн. Хар ус нуурыг хамарсан уг цогцолбор газрын байгалийн тогтоцыг судлаачид гайхамшигтай хэмээн дуу алддаг. Энд цэнгэг уст нууруудаас гадна ус намгархаг газар, говь хээр, тал хээр, Алтайн мөнх цаст сарьдаг уулс байдаг бөгөөд байгалийн гайхамшигт урлан мэт оршдог. Зарим тохиолдолд үзүүлэн болгож зориуд урласан мэт харагддаг. Энд ирсэн гадаадын жуулчид Хар ус нуурыг “газрын диваажин” хэмээн шагшин магтдаг билээ.
Тус цогцолбор газарт 54 зүйлийн хөхтөн амьтан, 268 зүйлийн жигүүртэн шувуу, 455 зүйлийн өвс ургамал, 4 зүйлийн загас, 6 зүйлийн мөлхөгч амьтан, 131 зүйлийн шавьж амьдардгийг тогтоосон байна. Гэвч Хар ус нуурын хөвөө орчмын айлууд зэгс хулсыг нь хайр найргүй устгаснаас болж Ховд, Буянт голын бургас бут сөөг багасан, нуурыг тэжээдэг олон салаа гол хатаж ширгэжээ. Үүнээс болж хорт өвсний тархац нэмэгдэн малын бэлчээр хомсдож байгаа ажээ.",,,https://drive.google.com/drive/folders/1Fr2SU1TLG7-BhbhycOp7cqvABzJ7UO-Z,https://drive.google.com/drive/folders/1Fr2SU1TLG7-BhbhycOp7cqvABzJ7UO-Z
1/31/2023 8:54:14,Khovd,Мөнххайрхан уул,,,"Төв Азийн цөлийн нөлөөнд орших хязгаарлагдмал нөхцөлд бүрэлдэн тогтсон мөнх цэвдэг, мөсөн голууд бүхий өндөр уулын өвөрмөц газарзүйн тогтоцыг хамгаалах, байгалийн цэнгэг усны асар их нөөцийг хадгалах, мөнх цас, мөсөн голоор тэжээгддэг Алтайн нурууны ар өвөр хажуугаас эх авч урсдаг их бага олон голуудын эхийг хамгаалах, хөрсний чийгийн горимыг тогтвортой байлгах чухал ач холбогдолтойг анхаарч 2006 онд УИХ-ын 26 дугаар тогтоолоор улсын тусгай хамгаалалтанд авсан байна. Хамгаалалтын захиргаа нь Ховд аймгийн Мөнххайрхан сумын төвд байрладаг.
Мөнххайрхан уул, түүний орчмын газар нутаг нь Баян-Өлгий аймгийн Булган сум, Ховд аймгийн Мөнххайрхан сумын хил залгаа нутгийг дамнан 40-80 километрийн өргөнтэйгөөр баруун хойноос зүүн урагш 200 гаруй километр үргэлжлэн оршдог. Мөнххайрхан уулын ноён оргил нь 4362 метр өндөр бөгөөд мөнх цас мөсөн гол бүхий Монголын хоёр дахь өндөр оргил болно. Мөнх цас, мөсөн гол нь 200-гаад ам километр талбайг эзлэн оршино. Монгол Алтайн нурууны мөсөн голуудын дундаж зузаан нь 56 метр байдаг бол Мөнххайрхан уулын мөсний зузаан нь 130 гаруй метр хүрч тус орны гол мөрний нийлбэр урсацаас бараг 2 дахин, газар доорхи хөдөлгөөнт усны нөөцөөс 5 дахин их цэвэр усны нөөц хадгалагдаж байгааг судлаачид тогтоосон байна. Булган, Сэнхэр, Үенч, Бодонч зэрэг томоохон голууд Мөнххайрхан нуруунаас эх аван урсдаг.
Мөнххайрхан уулын газар нутагт аргаль угалз, янгир, буга, ирвэс, Алтайн хойлог, ятуу, чоно, мануул, үен суусар, голын халиу, минж зэрэг ан амьтан нутаглахаас гадна хоёр нутагтан мөлхөгчдийн олон төрөл зүйл нэг дор оршдог 4 том тархац нутгийн нэг юм. Монгол улсын Улаан номонд орсон Тойрмын хонин гүрвэл ганцхан Мөнххайрхан уулын дэд мужид бий. Мөн ховорт тооцогддог ногоон бах, үхэрдэй, жунгаарын загас зөвхөн Булган голд бий.
Энэ нутагт Сибирийн ой, Төв Азийн цөлийн ургамал оршихоос гадна баруун талаас Казакстан-Тураны, зүүнээс Дорнод Азийн ургамлын аймгийн төлөөлөл нэвтрэн орж иржээ. Ховд аймгийн Булган сумын нутаг дахь Залаа уул, Магнай уул, Баяндаваа орчмын Их онгог зэрэг газруудад дэлхийд ховордсон, зөвхөн Ази тив, Монголд байдаг нэн ховор ургамал болох “залаархаг хавраг буюу чийр” ургадаг. Вансэмбэрүү, таван салаа, хонин арц, алтан зул, жамъяанмядаг, алтан гагнуур, юмдүүжин зэрэг эмийн ургамал ургана. Мөн шинэсэн ойн зурвастай бөгөөд нийт талбай нь 198 га хүрнэ. Голуудын татам дагуу шинэс, улаан хус, улиас, бургас, заган ой, харгана, чацаргана, сөөгөн шугуй, хайлаас, балгана ургасан байдаг.
Мөнххайрхан уулын орчимд Алтайн урианхайчууд, казакууд оршин суудаг. Мөнхайрхан уулын орчимд түүх соёл угсаатны байгалийн аялал, эрдэм шинжилгээ судалгааны аялал, уулын спортын аялал, Усан спортын аялал, ердийн хөсгийн болон явган аялал, спорт ан агнуурын аялал зохион байгуулахад тохиромжтой.",,,https://drive.google.com/drive/folders/1Fr2SU1TLG7-BhbhycOp7cqvABzJ7UO-Z,https://drive.google.com/drive/folders/1Fr2SU1TLG7-BhbhycOp7cqvABzJ7UO-Z
1/31/2023 9:06:37,Khovd,Баянзүрхийн буган хөшөө,바양주르흐 사슴돌,"헙드 아이막 무스트솜 버텅츠 계곡으로 내려가는 길에 있는 몽골 서부에서 가장 큰 돌 유적이다. 30여 개의 크고 작은 사슴돌, 석관묘와 적석묘가 있다. 비교적 뚜렷한 사슴, 칼, 그 외의 무기들이 음각되어 있을 뿐만 아니라 그때 당시 생활을 보이거나 범, 늑대 등 아직 해석하지 못한 색다른 모양들이 음각 되어 있다. ","Баянзүрхийн буган хөшөө нь Улаанбаатар хотоос 1153 км зайтай Ховд аймгийн  Мөст сумын төвөөс баруун зүгт 50 гаруй км-т Баянзүрх багийн төвийн орчимд бий. Энэ хөндийд нийт 30 гаруй буган чулуун хөшөө байдаг. Баянзүрхийн буган хөшөө нь “Тал дахь уран баримлын үзэсгэлэн” мэт сүрлэг бөгөөд Баруун Монгол дахь буган хөшөөний хамгийн том цогцолбор юм.Дээрх дурсгал буй газар орон нь эртний түүх соёлын дурсгалуудаар арвин баялаг. Тухайлбал буган хөшөөдөөс чанх өмнө зүгт овоолоостой хүрээ далантай хэд хэдэн том хиргисүүр, 10 гаруй булш буй бөгөөд энэ нь Баянзүрхийн хөндий Баруун Монголын эртний түүх соёлын чухал бүс нутаг агсныг илтгэнэ
Тавтын хөтлийн буган чулуун хөшөөд
Мөст сумын нутаг Тавтын хөтөл дээр 3 буган чулуун хөшөө бий. Эдгээр хөшөөд нь х.ө 46°56.932, з.у. 092°26.460-ын солбилцолд д.т.д. 2353 метрийн өндөрт оршино.Хөшөө-1.Өндөр 117 см, зузаан 17 см, өргөн 52 см. Зүүн талд гурван ташуу зураас дүрсэлжээ. Уг хөшөөг хөх саарал өнгийн боржин чулуугаар хийжээ.Хөшөө-2.Эхний хөшөөнөөс 220 см хойт зүгт байрлана. Цагаан саарал өнгийн боржин чулуугаар хийгдсэн. Өндөр 120 см, зузаан 18 см, өргөн 50 см. Доод бүс, урд талд нар дүрсэлсэн. Хөшөө-3.Өндөр 92 см, зузаан 25 см, өргөн 40 см. Дээд бүсийг дүрсэлжээ. 2-р буган чулуун хөшөөтэй ижил түүхий эдээр үйлдэгдэж, түүнээс 3 метр зайд босгожээ",,,https://drive.google.com/drive/folders/1Fr2SU1TLG7-BhbhycOp7cqvABzJ7UO-Z,https://drive.google.com/drive/folders/1Fr2SU1TLG7-BhbhycOp7cqvABzJ7UO-Z
1/31/2023 9:22:21,Khovd,Төрийн тахилгат Алтан Хөхий уул,,,"Улаанбаатар хотоос 1560 орчим км Ховд аймгийн Мянгад сум, Увс аймгийн Өмнөговь, Өлгий сумын нутгийг дамнан орших үзэсгэлэнт сайхан байгальтай, бие даасан томоохон нуруу юм. Алтанхөхий уул Алтны эх хэмээх газар Алтанхөхий хайрханы баруун энгэр, Ховд голын хөндийд оршдог байна.
Төрийн тахилга тайлахаас бусад үед гадаад, дотоодын иргэд төдийлөн очоод байдаггүй байжээ. Өөрөөр хэлбэл, дөрвөн улирлыг дамнан нүүдэллэх нутгийн малчдаас өөр хүний хөл хүрээгүй газар гэж хэлж болно. Нутгийн ардууд Алтан Хөхий уулыг 1761 оноос хойш өнөөг хүртэл жил бүр тахиж ирсэн хамгийн эртний тахилгат уулын нэг юм. 2005 оны 3 дугаар сарын 30-нд Ерөнхийлөгчийн 44 дүгээр зарлигийг гаргуулан Алтан Хөхий уулыг төрийн тахилгатай уул болгожээ.
Алтны эхийн ойролцоо мөөг, сонгино зэрэг хүнсэнд хэрэглэдэг ургамлаас гадна хүний нүдэнд тэр бүр өртөөд байдаггүй жамъянмядаг, вансэмбэрүү, алтангагнуур, гишүү балчирган зэрэг ховор төрлийн ургамал ургадаг. Ууландаа гөрөөс, янгир, аргаль гэх мэтийн ховор амьтад идээшилдэг. Алтанхөхий уулыг төрийн тахилгатай болгосноос хойш хэдэн жил өнгөрчээ. Нутгийн иргэд Алтанхөхий уулыг эрт дээр үеэс шүтэн биширч, өглөө бүр сүүнийхээ дээжийг өргөсөөр иржээ. Тэд сайн сайхан амьдарч яваагаа хайрхантай холбон тайлбарладаг. Мөн Алтанхөхий уулын эзэн савдгийг хилэгнүүлэх вий хэмээн идээний дээжээ байнга өргөдөг.  Алтанхөхий уул алс холоос сүр бараатай харагдана. Нохой гаслам халуунд ч Ханхөхий уулын орой цагаан малгай “өмссөн” мэт байх нь гайхалтай. Уг нутаг хөрсөн дороо үнэт эрдэнэ нуусан гэдгийг нутгийн ард мэддэг байсан тул Алтны эх хэмээн нэрлэсэн талаар нутгийн хөгшид ярьдаг байна.
",,,https://drive.google.com/drive/folders/1Fr2SU1TLG7-BhbhycOp7cqvABzJ7UO-Z,https://drive.google.com/drive/folders/1Fr2SU1TLG7-BhbhycOp7cqvABzJ7UO-Z
1/31/2023 9:32:11,Khovd,Харуул Овоо ,,,"Булган голын хөндийд нутаглах торгуудуудын босгосон 13 овооны нэг юм. Харуул овоо нь гурван үеэс бүтнэ. Доогуураа өргөн цүлхэгэр, дээшээ нэгэн жигд нарийсч цамхаг хэлбэрийг бий болгосон.  Хар саарал өнгийн занарлаг чулууг хавтгайгаар нь өрж, дундуур нь модон шургаагаар бэхэлгээ хийж зангидсан байдаг.
Эл овооны тухай ийм нэгэн домог буй. Урьд цагт, захчингуудын өлгий нутаг болох Жаргалан хэмээх нутагт хааны харуулын албыг гүйцэтгэх албатууд суудаг байжээ. Тухайн үед хойд Жаргалан уулаар харийн хошууны хил хязгаар залгаж байсан тул ийнхүү харуул манаа гаргажээ. Нэгэн айлын ганц хүү тэрхүү харуул манааны үүргийг олон жил гүйцэтгэсээр насан өөд болжээ. Түүнийг нутаглуулахаар хошуу ноёны зарлиг гарч харуулд гардаг байсан овооных нь дотор талд харуул хүүгийн унадаг морь, анч нохой, зэр зэвсгийн хамт хийж чулуугаар хашиж бунхалсан ажээ. Овоог босгоход Ар Жаргалантын голоос Харуулын овоо хүртэл хүмүүс нэг эгнээ болон зогсож зуурсан шавар, чулуу, модыг гар дамжуулан уулын оройд гаргасан гэж ярьдаг.
Өөр нэгэн домогт, энэхүү Харуул овоо сүндэрлэн байх нутагт цаг төр үймж, өвчин тахал дэлгэрч түмэн гамшиг тохиолджээ. Эл зовлон бэрхшээлийг гэтлэх арга замыг асуулгахаар Тангад нутагт элч илгээжээ. Тангадын мэргэн лам нар “танай нутгийн нэгэн сайн эрийг амьдаар нь бунхлан оршуулваас энэ гай зовлон арилах юм байна” хэмээн хэлжээ. Явсан элч хаандаа энэ тухай айлтгахад хаан шадар жанжингуудаа цуглуулж энэ тухай хэлж “та нарын аль нэгийг нь бунхлан оршуулахаас өөр аргагүйд хүрлээ” гэхэд баатар жанжид нь бараан царайлан чив чимээгүй сууцгаав гэнэ. Тэгтэл хааны ач хүү нь “нутаг хошуугаа аюул гамшигаас аврах юм бол би бунхлуулъя” гэжээ. Хаан үүнийг сонсоод ихэд цочирдсон боловч нутаг орныхоо амар амгалан, өвчин зовлонгүй эрүүл энхийг эрхэмлэн ач хүүгийнхээ хүсэлтийг ёсоор болгожээ. Ингээд ач хүүгээ хайртай хүлэг морь, өвч бүрэн хуяг дуулга, зэр зэвсэгтэй нь Харуул овоон дотор амьдаар нь бунхалжээ. Ач хүү гурван өдөр, гурван шөнө бунхан дотор дуулж байх нь сонсогдсоор чимээ алдарсан ажээ. Тэр өдрөөс хойш Харуул овоог нутаг усаараа хүндэтгэн хэн ч хөндөлгүй өдийг хүрчээ.
",,,https://drive.google.com/drive/folders/1Fr2SU1TLG7-BhbhycOp7cqvABzJ7UO-Z,https://drive.google.com/drive/folders/1Fr2SU1TLG7-BhbhycOp7cqvABzJ7UO-Z
1/31/2023 9:36:12,Khovd,Ямаан усны хадны сүг зураг,,," Улаанбаатар хотоос 1550  орчим км зайтай Ховд аймгийн Үенч, Алтай сумын зааг нутагт Ямаан усны хавцал оршдог. Уг хавцал хоёр талаасаа эгц цавчим ханан хясаагаар хашигдсан давчуу бөгөөд зүүн талын ханан хаданд хүн төрөлхтний өв соёлд үнэтэй байр суурь эзлэх хэдэн зуун хадны сүг зураг байдаг. 
Анх 1973 онд Ховд, Говь-Алтай аймагт ажилласан бичиг үсэг, хадны зураг судлах анги Ямаан-Усны хавцал дахь Ханан хаднаас түрэг бичээс илрүүлжээ. Монголын нутагт 22 газарт түрэг бичээс байгаагийн нэг нь энд бий.
Энэхүү хавцал нь хоёр талаасаа эгц хадан ханаар хашигдсан. Дундуур нь горхи урсдаг. Харин уг горхиноос янгир, ямаа ундаалдаг учраас Ямаан ус гэж нэрлэх болжээ. 10 орчим метрийн өндөр ханан хаданд түүхийн өөр өөр үед холбогдох зургуудыг нэлээд гүн хонхойлон сийлсэн нь 100 гаруй метрийн холоос маш тод харагдана. Ямаан-Усны хадны зургийг нийт 4 хэсэг талбайд зуржээ.
Ямаан-Усны хадны зураг нь зохиомж, харьцаа, хэллэг гүйцэтгэлээрээ Монголын хүрлийн үед холбогдох хадны  зургуудын дотор чухал байр эзэлдэг. 
Хавцлын хананд янгир, буга, зээр, бөхөн, чоно зэрэг амьтад, найман хигээс дугуйтай морин тэргэнд суусан хүн, нум сум агссан анчид, нум сум харваж байгаа хүний араас сүх далайн цохих гэж буй дайн тулааны шинжтэй дүрслэл зургууд байна. Энэхүү зурагнаас Монгол нутагт язгууртнууд морин тэрэг хэрэглэж байсан гэдгийг нотлох боломж гарчээ.
Мөн тэрэгний урд замчилж хөтөлсөн зэвсэгтэй хүн, ард нь морьтой дагасан хүний дүрслэл байгаа тул эрт үеийн язгууртнуудын эрх ямбыг илэрхийлсэн хэмээн үздэг. ",,,https://drive.google.com/drive/folders/1Fr2SU1TLG7-BhbhycOp7cqvABzJ7UO-Z,https://drive.google.com/drive/folders/1Fr2SU1TLG7-BhbhycOp7cqvABzJ7UO-Z
