Timestamp,Aimag,Title (100),Title Korean (100),Description Korean (255),Description (255),About ,About Korean ,Cover (Link),Thumbnail (Link)
1/25/2023 8:42:46,Darkhan-Uul,Дурлалын мод,,,"Дархан-Уул аймгийн нутагт Зулзаган голын амралтын бүсэд очих зам зуурт нарсан ойн дундуур явсан шороон замын дэргэд байдаг. Хоорондоо орооцолдож ургасан байдаг бөгөөд эр хүнийг бэлгэдэх мод нь арай өргөн, хүрэн өнгөтэй бол эм хүнийг бэлгэдэх мод нь арай нарийхан гоолиг, цайвар шаргал өнгөтэй байдаг байна. Хос модны дэргэд нутгийнхны босгосон жижиг овоо байдаг. Тэр овоонд ганц бие гэрлээгүй залуучууд “сайн хань заяаж хайрла” хэмээн сүслэн залбирч мөргөдөг уламжлалтай.
",,,,https://drive.google.com/file/d/1jKpTO7YG031Ft-zfouvGQ29XI4YO4ifJ/view?usp=share_link
1/25/2023 8:47:45,Darkhan-Uul,Шарын голын зосон зураг,,,"Дархан хотоос хойш 25 км орчимд Шарын голын хойд хөндийд орших жижиг нуурыг Цагаан нуур гэнэ. Нуураас зүүн тийш 5 км орчимд Шарын голын хөндий руу хойноос нь төрж орсон хадтай жижиг уул буй бөгөөд урд баруун хормойгоор нь дугуй, дөрвөлжин чулуун далантай жижиг булш 20 гаруй тааралдана. Тэрхүү уулын урд талын хясаалж тогтсон толигор хаданд эрт үед гурван хэсэг газар улаан зосоор зураг зурсныг 1980 онд А.П.Окпадников, Д.Дорж нарын удирдсан Монгол-Зөвлөлтийн түүх, соёлын хамтарсан экспедицийн чулуун зэвсгийн дурсгал судлах ангийнхан олж илрүүлжээ.",,,,https://drive.google.com/file/d/1N3QYGuGh0DU8TNjfDtxZPhLPT7r9BfO9/view?usp=share_link
1/25/2023 9:02:09,Dornogovi,Хамрын хийд ,하마르 사원 ,"이 사원은 더른고비아이막 중심인 사잉샨드시에서 45km 떨어져 있다. 19세기 유명시인인 단장랍자가 1820년 당시 17세 대 어워르하마르라는 곳에 이 사원을 설립하였다. 하마르사원은 1938년 까지, 네 부분으로 이뤄져 80칸 법당에 500 승려들이 수행하였던 홍모파사원이였다. 사원을 파괴하였을 적에 투데브 승려가 단장랍자 무덤에서 64개의 상자에 물건을 가득 담아 몰래 가져 나와 1990년까지 땅 속, 동굴 속에 묻어 놓아 감추어 52년 동안 보관해 왔다. 몽골이 시장경제사회로 전환한 후 본 사원을 다시 복원하게 되었고 그 동안 보과해 온 물건들을 제 자질에 돌려 놓았다. 현재 약 열 승려가 이곳에서 수행하고 있다. ","Улаанбаатар хотоос 521 км зайтай Дорноговь аймгийн Эрдэнэ сумын нутаг, Сайншанд хотоос урагш 38 км-т орших Хамрын хийд нь ноён хутагт Данзанравжаагийн байгуулсан Шарилын уулын 3 хийдийн нэг, түүний аж төрж, уран бүтээлээ туурвиж байсан дурсгалт газрын нэг юм. 
1821 онд байгуулагдсан энэ хийд нь Зүүн хүрээ, Баруун хүрээ, Цохон, Дүйнхэрийн гэсэн 4 хэсэгтэй. Ихэнх нь төвд , монгол хийцийн сүм дугануудтай.
Зүүн хүрээнд нь ноён хутагт голлон суудаг байсан ба энд Лаврин сүм, Авга дацан, хүүхдийн дацан сургууль, номын сангаас гадна Хамбын, Лам нарын, Шүтээний, Номчийн аймгуудтай байсан. Энд IV ноён хутагт Жамъян Ойдовжамц, VI ноён хутагт Лувсандондов нарын шарилын сүм байсан хийгээд Лаврин сүмд ноён хутагт Данзанравжаа болон дараах хутагтууд амьдран сууж байв.
Хамрын хийдэд Амаагийн гандай эргэх, цам гаргах, маань хөгжөөх зэрэг шашны зан үйл байнга болдог бас ноён хутагтын “Саран хөхөөний намтар” жүжгийг жил бүр найруулан тавьдаг байжээ.
“Саран хөхөөний намтар” дуулах дацан нь ноён хутагтын уран бүтээлийг олонд үзүүлэх зорилгоор барьсан задгай театр байв. Энэ дацан нь 3 давхар. Сүм хэлбэрийн байшинтай, 35 жангийн хэмжээтэй уг театрыг салхины урсгал тааруулж барьсан учраас үзэгчдэд жүжгийн яриа, хөгжмийн аялгуу хүрэхэд хялбар байжээ.
Хамрын хийдийн орчимд агын ёсны жарз бясалгал хийдэг арваад агуй, нутгийн ардууд хутагтын адисласан ус хэмээн нэрлэдэг ноён хутагтын гаргуулсан худаг бий. Эл худгийн усыг тэрээр ходоод, элэг дотор эрхтний гэмийг арилгахад тустай хэмээн “Рашаан булаг хэмээх адистай усны судар оршвой” гэдэг номондоо бичжээ.
1930 онд 13 дацан, 4 аймаг, 22 дуган, 2 суварга, 11 сүмтэй байсан Хамрын хийд сүм хийдийг галдан шатаасан 1937-1938 оны үед туйр болтлоо сүйджээ.",,,https://drive.google.com/drive/folders/1Fr2SU1TLG7-BhbhycOp7cqvABzJ7UO-Z,https://drive.google.com/drive/folders/1Fr2SU1TLG7-BhbhycOp7cqvABzJ7UO-Z
1/25/2023 9:25:58,Dornod,"Хэрлэн Барс хотын туурь, цамхаг",,,"Төв Азийн бүс нутагт цорын ганц үлдсэн Киданы үеийн дурсгал, Хэрлэн барс хотын туурь, цамхаг нь МЭ IX зууны үед хүчирхэгжиж байсан Kидан гүрний үетэй холбогддог. Тэр үед Киданчууд нийслэл хотоо энд байгуулахаар шаваа тавих үед нь нутгийн хүмүүс бараар далайлган айлгаж буцааснаар ийм нэрийдсэн домогтой. Судлаачид 7 метр орчим энэхүү өндөр баганыг мөн ямар нэгэн хотын харуулын цамхаг байсан гэж үздэг.

Хэрлэн барс хот нь Монгол оронд байгаа Хятаны үеийн хотын туурь балгас юм. Энэхүү балгас нь Дорнод аймгийн Цагаан-Овоо сумын нутагт Чойбалсан хотоос баруун тийш 12 км-т хэрлэн голын эрэгт оршино.",,,https://drive.google.com/file/d/1sTgQ2LGIjPvIfp2UWSuzjHTQwUSQYSJi/view?usp=share_link,https://drive.google.com/file/d/1tPdsSFHWq7Q3Fu53eJFX_CkNyvJRf_Gs/view?usp=share_link
1/25/2023 9:29:35,Dornogovi,Цагаан Дарь Эх ,,,Зүүн жанжин Чойрын хийдийн Цогчин дугана байсан газраас холгүй арын Цагаан Дарь эх хэмээх хадны бурхан бий. Энэхүү бурхныг маш эртний галбын барзгар боржин чулуун хадны элгэн биеэс ургуулах мэт товойлгон долоон тохой хагас талбайд товойлгож сийлсэн нь бусдаас ялгагдах ур хийц юм. 1828 онд Зүүн Чойрын хийдийн орчимд хэжиг өвчин дэлгэрч лам хар олон хүний аминд хүрсэн гэдэг.Иймд энэ өвчнийг дарах арга хайсан нутгийн ардууд урт наслуулахын ерөөлт бурхан Цагаан Дарь эхийг Чойр дацангийн дуганы гол хаалга чиглүүлж уран бурханчаар бүтээлгэвэл дарагдана гэснээр уул хадаар хэрэн хэсэж бурхан бүтээж явдаг нэгэн бурханч ламыг залж энэхүү бурхныг хийдийн гол дуганыг чиглэн байрлах боржин хадан дээр бүтээлгэсэнд халуун хэжиг өвчин дарагдсан гэдэг ,,,https://drive.google.com/drive/folders/1Fr2SU1TLG7-BhbhycOp7cqvABzJ7UO-Z,https://drive.google.com/drive/folders/1Fr2SU1TLG7-BhbhycOp7cqvABzJ7UO-Z
1/25/2023 9:33:20,Dornod,Буйр нуур,보르 호수,"호수의 크기는 615km2 이다, 몽골 서부에 있는 호수 중에 제일 큰 담수호이다. 길이는 40km, 넓이는 21km, 호숫가 총 길이는 113km이다. 평균 수심은 6-10m이며, 가장 깊은 곳에서는 10-50m에 이른다. 보르호수 물은 함수탄산염, 염화나트륨, 칼슘 등을 함유하고 있다, ","Аймгийн төвөөс 336км. Нүд унагам үзэсгэлэнт байгалтай уг нутаг нь байгаль болон түүхийн хувьд заавал үзэх ёстой газрын нэг. Хамгийн гүн хэсэгтээ 10-50 метр хүрдэг уг нууранд Халх гол цутгаж, Оршуун гол эх авч гардаг болохоор эргийн дагуу бургас, нишингэ ургасан байдаг. Нуурын өмнөд эрэг хавиар түрэлт давлагаагаар үүссэн 3-5 метр өндөр элсэн далан үргэлжлэх бөгөөд тэдгээрийн завсар хооронд жижиг нуурууд тогтож зарим нь үндсэн нууртайгаа холбогддог маш цэнгэг устай нуур юм.",,,https://drive.google.com/file/d/1K6LC1WQS1pEbGKMaV24kwzKNS51xTurj/view?usp=share_link,https://drive.google.com/file/d/1K6LC1WQS1pEbGKMaV24kwzKNS51xTurj/view?usp=share_link
1/25/2023 9:40:10,,"Сүйхэнт уул, Өлгий хийд ",,,"Дорноговь аймгийн Мандах сумын нутагт орших Өлгий хийд 1745 онд байгуулагдсан бөгөөд тухайн цаг үедээ 1000 гаруй ламтай байжээ.Тус хийд нь Өлгий уулын бэлд, уул руугаа түрж орсон байдалтай, баруун хойд талаараа Баян-Улаан хэмээх рашаан ус бүхий уулс, зүүн хойд талаараа Хорго хайрхан уул, урд талаараа Эргэлийн зоогоор хүрээлэгдсэн байдаг.Гол дуганыхаа ард даяан хийж бясалгадаг агуйтай. 1936 онд тус хийдийн 20 гаруй толгой ламыг баривчилж эхэлснээр улс төрийн эсэргүү нарын бүлгэм хэмээх хэрэг тулган 1792 тоот хавтаст хэрэг нээж ихэнх лам нарыг буудан хороожээ.
Эл төв нь Өлгий хийд буюу сөнөсөн хот юм. Монголын нутагт сөнөж мөхөж устсан олон арван хот суурингууд байдаг ч тэдгээрийг сөнөсөн хот гэж нэрлэдэггүй бөгөөд гагцхүү энэ хийдийг сөнөсөн хот гэж нэрлэдэг байна.Сөнөсөн хотын талаар хүмүүс их сонирхож асуудаг боловч энэ талаархи материал маш хомс байдаг.Энэ хийд нь 1745 онд байгуулагдаж 1937 оны их хэлмэгдүүлэлтийн үед устгагдсан байдаг.Өлгий хийд нь ид хөгжилийнхөө үед 1000 гаруй ламтай, таван дацантай говийн томоохон хийдүүдийн нэг байжээ.",,,https://drive.google.com/drive/folders/1Fr2SU1TLG7-BhbhycOp7cqvABzJ7UO-Z,https://drive.google.com/drive/folders/1Fr2SU1TLG7-BhbhycOp7cqvABzJ7UO-Z
1/26/2023 2:41:41,Dornogovi,Цонжийн Чулуу ,,,"Сумын төвөөс зүүн хойш 55  км-т орших Цонж толгой нь зургаан талт босоо гонзгой бие биедээ наалдан ургасан  зургаан талт  харандаа мэт сонин сайхан тогтоцтой цэнхэр чулуу, байгаль эхийн уран чамин урлалт   жижиг уул юм.Эрт  үед  энэ чулуунаас ухаж авч байсан ул мөр бий. Ухсан  хэсэг нь 3-4 метр гүнзгий жигд хэмжээтэй, нарийхан, урт шулуун чулууны багц бөгөөд дээрээс нь харахад зүсмэл чулуун шал мэт.
Хүний гараар бүтээсэн 6 талт баганууд мэт хүрмэн хөх чулуун байц хадууд , өндөр нь 6-7 м, өргөн нь 15-20 см хөх хүрмэн чулуу юм. Асар их даралтад орж ийм багана үүсч талсжсан хэрэг. Үүнийг нутгийнхан “Цонжийн чулуу “ гэдэг.  Энэ өмөрмөц уулыг аймгийн байгалийн нөөц газрын тусгай хамгаалалтад  1988 онд 18,0 га талбайтайгаар бүртгэн авсан байна. ",,,https://drive.google.com/drive/folders/1Fr2SU1TLG7-BhbhycOp7cqvABzJ7UO-Z,https://drive.google.com/drive/folders/1Fr2SU1TLG7-BhbhycOp7cqvABzJ7UO-Z
1/26/2023 3:09:19,Dornogovi,Бүрдэнэ ус Мөнхийн булаг ,,,"Дорноговь аймгийн Эрдэнэ сумын төвөөс баруун урагш 27 км зайтай оршдог. 11 га талбай бүхий элсэн манхан, булаг ус, говь нутгийн үзэсгэлэн болсон баянбүрд юм.  Эгц өндөр элсэн манхан дотор 108 булагтай, зүлэг ширэгтэй, худагтай, мод буттай байгалийн маш үзэсгэлэнтэй газар юм. Харахад ус бүхий баянбүрд шиг ердийн элсэн манхан боловч элснийх нь ид шид гайхагдсаар иржээ. Говийн догшин ноён хутагт Д.Равжаа өөрийн лам нараа дагуулан ирж 108 булаг тус бүрд ном уншуулан лүйжин тавьдаг зоч лам нарыг бэлтгэдэг байсан бөгөөд лүйжинч лам нар 3-7 хоног бясалгал үйлддэг байжээ. (Лүйжин гэдэг нь бие хэл сэтгэлийн элдэв бузар, мууг арилгахад үдэш бүрэнхийгээр уншдаг ном) Бүрдэнэ булагийн хойд талд байх хайрханыг Догмиддорж хэмээх ба уулын энгэрт жижиг хийдийн туурь бий
лсний чанар нь бөөрний түүдгэнцэр, дэвшинцэрийн хурц архаг үрэвсэл зэргийг анагаах увидастай болох нь тогтоогдсон байна. Мөн сумын төвөөс  38 км зайтай Адрамгийн уулын баруун хэсэгт ар тийш харсан хайлаас модтой аманд байдаг мөнхийн устай булаг бий. Энэхүү уулын аманд ан амьтан төрөл бүрийн хорхой, мөлхөгчид элбэг байдаг. Нэгэн домгоос үзвэл, нэгэн цагт хагархай Мөнх гэдэг хүн алга болж хэд хоногийн дараа булгийн усан дээр малгай, тамхины уут зэрэг нь хөвж байсан учир энэ хүний нэрээр нэрлэсэн гэх.
Булаг нь ширгэдэггүй. Учир нь мөнх устай гэснээс нэрлэгдсэн байж болох учиртай. Энд байгалийн янз бүрийн элемент, хортой, хоргүй аварга болон суман могой элбэг байдаг  гэдэг. ",,,https://drive.google.com/drive/folders/1Fr2SU1TLG7-BhbhycOp7cqvABzJ7UO-Z,https://drive.google.com/drive/folders/1Fr2SU1TLG7-BhbhycOp7cqvABzJ7UO-Z
1/26/2023 3:14:20,Dornogovi,Эргэлийн зоо,,,"Дорноговь аймгийн Хатанбулаг сумын нутаг дахь Эргэлийн зоо нь байгалийн сонин тогтоцтой археологийн олдвор ихтэй газар бөгөөд 30 сая гаруй жилийн өмнөх шим ертөнцийн гэрч болсон эртний сүүн тэжээлтэн загас, яст мэлхий, гүрвэл зэрэг сээр нуруутны олдворыг хадгалсан хурдас чулуулгаас тогтсон ширээ хэлбэрийн тэгш өндөрлөг юм. Иймээс эртний амьтан, ургамлын ховор олдворыг байгалийн байдлаар нь хадгалах зорилгоор 1996 онд УИХ-ын 43 дугаар тогтоолоор тусгай хамгаалалтад авсан байна. Анх 1922-23 онд Америкийн эрдэмтэн Рой Чэпмен Эндрюс судалж байсан байна.
Оросын эрдэмтэн И.А.Ефремов, Польшийн нэрт эрдэмтэн К.Яваровская нарын удирдсан олон экспедиц ажиллаж байжээ. Энэ газрын тухай дэлхийн эрдэмтэдийн бичсэн 50 орчим эрдэм шинжилгээний бүтээлүүд байдаг ба тэдгээрт “Алтан уул” хэмээн нэрлэгдэж энэ нэрээр алдаршсан байна. Эргэлийн зоогоос олдсон эрт галавын олон амьтаны чулуужсан яс дэлхийн болон Монголын байгалийн түүхийн музейнүүдэд хадгалагдаж байна. Эрт дээр үеэс ард түмэн энэ нутгийг тахин шүтэж, морь уралдуулж, бөх барилддаг байсан домог яриа байдаг.
Энд бударгана, шар мод, гашуун суль, агь, хөмөл, таана, ерхөг, тэсэг, гоёо, цулхир, хармаг, алтан харгана, хайлаас зэрэг ургамал ургадаг. Амьтаны аймгийн хувьд хар сүүлт, цагаан зээр, хулан зэрэг говийн унаган амьтад,  үнэг, чоно, хярс, шилүүс, дорго зэрэг хөхтөн амьтад,  ногтруу, ятуу, элээ, хэрээ, ууль, сар, тоодог зэрэг олон зүйл жигүүртэн шувуудтай нутаг юм. ",,,https://drive.google.com/drive/folders/1Fr2SU1TLG7-BhbhycOp7cqvABzJ7UO-Z,https://drive.google.com/drive/folders/1Fr2SU1TLG7-BhbhycOp7cqvABzJ7UO-Z
1/26/2023 3:25:25,Dornod,"Хайлангийн хадны хүн дүрст чулуу, дөрвөлжин булш",,,"Хайлангийн хадны дурсгалд, буган чулуун хөшөө, хүн дүрст хөшөө, дөрвөлжин булш зэрэг хүрэл зэвсгийн үеийн томоохон соёлууд зэрэгцэн оршсон цогцолбор дурсгал бүхий газар манай оронд цөөхөн тохиолддог. Тиймээс Дорнод Монголын хүрэл зэвсгийн түүхийг өгүүлэх, хүрэлийн үеийн томоохон соёлууд нэг дор оршсон соёлын цогцолбор дурсгалт газар хэмээн үзэх үндэслэлтэй.

Дөрвөлжин булш нь гадаад хэлбэр зохион байгуулалтаараа нэлээд эртний хэлбэртэй, оюуны болон эдийн соёлын тухай олон мэдээллийг өгч чадах түүх, соёлын үл хөдлөх дурсгалууд юм. Монгол оронд хүрэл зэвсгийн үеийн дөрвөлжин булшийг одоогийн судалгааны мэдээгээр 510 орчмыг малтан шинжилсэн байна.",,,https://drive.google.com/file/d/1xrtq5a6za7Dobq66zu_5ZmPx9uMhxqST/view?usp=share_link,https://drive.google.com/file/d/1ij8E6mWGu3Ckj0RlRL5XvSFL28fk-Fmc/view?usp=share_link
1/26/2023 3:25:49,Dornogovi,Нүдэнгийн Хонхор ,,,"Нүдэнгийн хонхор нь Сайншандаас 80 км-т, Айраг сумын төвөөс 43 км-т, Нүдэн багийн төв энд байрладаг. Уг газарт Нүдэнгийн хадны завсараас гардаг ходоодонд сайн рашаан, оролцоох ойрмоос нь ходоодонд сайн гэж амны хужир авдаг бөгөөд малчид мал хүн өргөнөөр хэрэглэдэг. Зүүн талд нь “Хөх өндөр” хэмээх тахилгат овоо байдаг. Нутгийн иргэд жил бүр тахидаг. Цайдмын тойром болон Нүдэнгийн орчмоор байгалийн сонин дүрс тогтоц бүхий хад чулуутай. Нүдэнгийн хийд 1945 оноос 1960 он хүртэл сэргээгдэн ном хурж байсан. Одоо бурхан шүтээн нь Гандан тэгчлин хийдэд очсон гэдэг.  Нүдэнгийн хийдэд ноён хутагт Данзанравжаа Түгээмэл элбэгтийн 2-р оны хавар Далантүрүүгийн рашаан орох замдаа морилон саатаж байсан гэх яриа байдаг. Нүдэнгийн хадны рашааныг ходоодонд сайн гэдэг бөгөөд рашааныг зөвхөн эрэгтэй хүн очиж авдаг бөгөөд хэрэв эмэгтэй хүн авбал ус нь ширгэдэг онцлогтой гэдэг.",,,https://drive.google.com/drive/folders/1Fr2SU1TLG7-BhbhycOp7cqvABzJ7UO-Z,https://drive.google.com/drive/folders/1Fr2SU1TLG7-BhbhycOp7cqvABzJ7UO-Z
1/26/2023 3:38:55,Dornod,Их бурхант чулууны цогцолбор,,,"Дорнод Монголын түүх, соёлын томоохон дурсгалуудын нэг, Сүмбэр сумын нутагт орших “Их бурхант” чулуун бурханы цогцолбор дурсгалыг Халхын Сэцэн хан аймгийн жүн ван Бат-Очирын Тогтохтөрийн /То ван 1797-1868/ санаачлага удирдлагаар 1859-1864 онд бүтээсэн дурсгал “Их шүтээн”, “Их бурхант” хэмээн олноо алдаршжээ. Энэ дурсгалыг найман аюулаас аврах Арьяабал бурханч гэдэг. Түүний гарт нь арслан, заан, могой, гал, ус, гав гинж, хүний бодол санаа зэрэг найман утгыг агуулсан билэгдэл атгаастай байдаг. Их Бурханыг Монгол улсын дорнод хил хязгаарыг аюул гамшигаас хамгаалахын билгэдэл болгон барьсан гэж олны дунд яригддаг боловч То ван ард олон шүтлэг бишрэлээс шалтгаалж асар их эд хөрөнгө түвд, энэтхэг, хятад руу урсаж байгааг гярхай ажиглаж энэ бүх буяныг нутаг орондоо тогтоох зорилгоор барьжээ гэсэн саналууд бий. Их бурханыг бүтээхэд мянган үхэр тэрэг хөдөлгөж долоон жилийн турш барьсан гэдэг. ",,,https://drive.google.com/file/d/1e-tCkqyirz4N3wMWwUX82ahe9d7enKn2/view?usp=share_link,https://drive.google.com/file/d/1jQI8CQm7g7lDf2Wkwooz7lxzuFst_FGT/view?usp=share_link
