Timestamp,Aimag,Title (100),Title Korean (100),Description Korean (255),Description (255),About ,About Korean ,Cover (Link),Thumbnail (Link)
1/27/2023 8:03:00,Övörkhangai,Эрдэнэзуу хийд ,에르덴조사원,"하르호름 수도터에 에르덴조사원을 세웠다. 1585뇬 압타이사잉왕이 자신의 동생 투멩헹과 같이 제 3대 달라이라마를 방문하였는데 그의 추천대로 하르호름시의 타하이라는 사원을 복원하였다. 그리고 이를 점차 확장해 나가 여러 사원을 건립하였고 1796년에 한 대공사로 50대의 석탑을 세웠다. 1802-1813년 사이에 신도들의 후원으로 쉰여섯 탑을 추가로 세웠다. 현재 사원을 둘러있는 108탑 길이는 420m의 정사각형이다. 1782년에 50명의 승려들이 수행하고 있었다. 그때 당시에 개인 사원을 하고 있는 것은 신분과 부의 상징이었기 때문에 더 세워지게 되어 1792년에 62채 사찰, 500채 건물, 10.000명의 승려로 확장되었다. 현재 18채의 사찰과 비석과 빗돌 유물이 남아 있다. ","Эрдэнэ Зуу хийдийг Их Чингис хааны алтан ургийн Гэрсэнз жалайр хун тайжийн 3-р хөвгүүн Онох Үйзэн ноёны ахмад хүү Абтай сайн хан 1586 онд байгуулжээ. Автай сайн хан Халхын цэргийг удирдан мордож, Хөвхөр хэрээ хэмээх газарт Ойрадтай байлдан ялж өөрийн ахмад хөвгүүн Субугадайг илгээж, Ойрадад хаан суулгаад нутагт хүргүүлэн явахад нэгэн толгойгүй хонхны цар олж нэрийг нь мэдэхгүй дуу гаргаваас дэмий сайханд авч явтал Түмэдийн газраас хэдэн худалдаачин ирсэн ажгуу.Тэд нараас асууваас ном уншихад хэрэглэдэг хонх гэв. Ном гэгч юу буй хэмээв. Бурхны зарлиг гэв. Бурхны зарлиг ямар буй хэмээвээс таван хүмүүн хол сууж бичгээр аль учрыг хэлэлцэж мэдсэнд Абтай сайн хан маш гайхаж, их бишрэл сүсэг төрөөд, Бурханы шашинд үлэмж сүжиглэсэн . 1586 онд III -р Далай лам Содномжамцыг Түмэдийн Хөх хотод морилж буй үед Абтай сайн хан өөрийн дүү Түмэнхэн сайн ноёны хамт очиж бараалхан Далай ламд булганы арьс, алтадсан өргөө, алт мөнгө, 1000 агт тэргүүтэй мал сүрэг зэрэг үлэмж өргөл өргөжээ. Далай лам бээр Зуу Шигэмунийн эндүүгүй шарил эрхий хуруу төдий их гэрэл бадарсан нэгийг хайрлаж бас гэр дүүрэн бурхнаас сонгож автугай гэж зарлиг болсонд нэг хуучин хөрөг авсан нь галд үл шатсан Пагму түв Дорж жалбу ажгуу. Мөн “ Очирай сайн хаан цол ” , шар үсэг бүхий тамга шагнажээ.III-р Далай лам Абтай сайн хаантай уулзах үедээ өвөг дээдсийнхээ тахилын орныг сэлбэн засваас тэр оронд шашин төр аяндаа хослон дэлгэрэх болно хэмээн зарлиг болсон гэдэг. Эрдэнэ Зуу ба Өндөр гэгээний намтарт: Модон эм тахиа жил 1585 онд урьдын Чингис хааны III-р хөвгүүн Өгэдэй ноён хаан суусан ба хойно Тогоонтөмөр хаан сэлбэн барьж суусан Шарга азрага хэмээх Шанхат уулын ар дахь хуучин Тахай нэрт балгасны дотор өчүүхэн нэг байшин ордны дээд давхарт Далай ламын гэгээний биеийг дүрэмлэн өөрийн мутраар бүтээснээс Бурхны гэгээний мэндэлснээс хоёр мянга таван зуун дөчин зургаан жил, Богд Зонховын мэндэлснээс хоёр зуун хорин есөн жил болсны үед Хятадын арван гуравдугаар Ван Ли хааны арван дөрөвдүгээр онд үл барагдах нэрт гал эр нохой жилийн / 1586 / элдэв төгөлдөр хэмээх зуны дунд сарын 15 ны өдөр сүмийн нуруу босгож уламжилсаар байгуулж …. Далай лам гэгээнийг залья хэмээн айлтгасанд гэгээний ор болгон Сажийн үндэсний Лодойнямбуу хэмээх ламыг хайрлан айлдсаныг Зуугийн сүмд залж ирээд мөн тэр лам равнай үйлдэхийн сацуу урьд Далай лам бээр эндээс равнай айлдъя хэмээснээр мөн өдөр өмнө зүгээс үүл гэрэл мэт өнгөтэйн дотроос тутаргын арвай бууж гайхамшигтай адистад болов хэмээн Эрдэнэ Зуу хэмээн нэр өгөв. Үүнд: бүтээсэн шүтээнүүнүүдийн эрхэм нь Далай ламын өргөсөн гайхамшигт чандмань эрдэнэ мэт бурхны шарил тэргүүтэнийг залж, үүдэшгүй адистидат шүтээн ба чухал эрдэний зүйлүүдээр үүдсэн бурхан Шигэмунийн манлайд Бадамгарав өргөсөн нэг, Гурван цагийн бурхан, Вачирдара, Бадамсамбава, Сажа бандид Гунгаажалцан, Гарма лам, Найман бодисад, ба дээд бодисад хоёр, хэтэрхий сүр жавхлан бадарсан байдалт шажныг сахигч цэргийн чуулганыг тархаан дарагч зандан модон их бэрээг барьсан үүдсэн сахиус Гомбогүр нэг, дөрвөн мутарт Лхам нэг, дөрвөн Махранз болоод бас дээр залсан гурван цагийн долоон бурхан, арван зургаан Энэтхэгийн байдалт ахуй шүтээн, Сайн галавын мянган бурхан тэргүүтнийг амилуулав.",,,https://drive.google.com/drive/folders/1Fr2SU1TLG7-BhbhycOp7cqvABzJ7UO-Z,https://drive.google.com/drive/folders/1Fr2SU1TLG7-BhbhycOp7cqvABzJ7UO-Z
1/27/2023 8:17:15,Övörkhangai,Тэвш Уул ,,,"Улаанбаатар хотоос 514 км зайтай Өвөрхангай аймгийн Богд сумын нутаг, сумын төвийн дэргэд зүүн хойд зүгт салбарлан тогтсон хар уулыг тэвш уул гэж нэрлэнэ. Тэвш уулын эргэн тойронд олон төрлийн хадны сүг зураг байхаас гадны булш хэрэгсүүрүүд ч олон байна. Сүүлийн жилүүдэд Хонгорын элсийг зорих аялагч жуулчид Тэвш ууланд саатан хадны сүг зураг дүрслэлийг үзэж сонирхох нь их болсон.
Тэвш уулын хадны зурагт элдэв ан амьтан, анчин гөрөөчин, мал аж ахуй, хүмүүсийн амдрал ахуйг харуулсан зургууд голлоно. Ан амьтдын дотроос буга, янгир, тэмээ, адуу, нохой зэргийг хаданд хонхойлон дүрслэсэн байдаг. Ахуй амьдралтай холбоотой зургууд үхэрт нуруу ачсан, ямар нэгэн зүйлийг чирүүлсэн, морь хөтөлсөн хүн, морьтой болон явган хүмүүс адуу малыг тууж яваагаар дүрслэсэн байна.",,,https://drive.google.com/drive/folders/1Fr2SU1TLG7-BhbhycOp7cqvABzJ7UO-Z,https://drive.google.com/drive/folders/1Fr2SU1TLG7-BhbhycOp7cqvABzJ7UO-Z
1/27/2023 8:26:05,Övörkhangai,Төвхөн Хийд ,,," Улаанбаатар хотоос 450 км зайд байрлах Төвхөн  хийд нь Өвөрхангай аймгийн Бат-Өлзий  сумын  нутаг далайн төвшнөөс  дээш 2300 м  өндөрт өргөгдсөн Төвхөн  ширээт  уулын оройд  оршдог. Төвхөн хийдийг анхдугаар Богд Өндөр Гэгээн Занабазар 19 насандаа буюу 1654 онд  үүсгэн  байгуулжээ. Хийд нь нямба, бясалгалд зориулан алслагдсан зайтай, битүү ой модоор хүрээлэгдсэн уулын оройд байгалийн сайхан газарт бүтээгдсэнээрээ онцлог юм. Хийдийн баруун талд шүтээний хэсэг, зүүн  талд нь жас байрлана.  Шүтээний хэсэгт Бүтээлийн сүм, Хурлын дуган, Сэмчин дуган, хоёр  суварга  бүхий мөргөлийн цогцолбор, тахилгат худаг, бясалгалын хоёр агуй,  тахил тайлгын овоо багтана.  Хийдэд Өндөр Гэгээний  мутар, өлмийн мөр, Гэгээнтний морины  уяа гэгдэх байгалиас  холбоотой хоёр  мод,  махгал  мод, эхийн  умай хад, өлгий хад  гэх  мэт  Өндөр  гэгээний  намтар түүхтэй  холбоотой  дурсгалууд олон байдаг. ",,,https://drive.google.com/drive/folders/1Fr2SU1TLG7-BhbhycOp7cqvABzJ7UO-Z,https://drive.google.com/drive/folders/1Fr2SU1TLG7-BhbhycOp7cqvABzJ7UO-Z
1/27/2023 8:37:30,Övörkhangai,Элсэн тасархай,엘셍타스라하이 / 미니고비,"투브아이막의 에르덴산트솜과 우브르항가이 아이막의 부르드솜, 볼강 아이막의 고르왕볼락소을 거쳐 바트항산 서부부터 후그느산 서부까지 80km 뻗어 있느 거대한 줄기 사막이다. 중앙에 길이 놓이게 되어 사막이 중간에 갈라졌다. ","Элсэн тасархай нь Улаанбаатраас 280 км зайтай Төв аймгийн Эрдэнэсант, Өвөрхангай аймгийн Бүрд, Булган аймгийн Рашаант сумдын нутгийг дамнан Батхаан уулын баруун талаас эхэлж Хөгнө хаан уулын баруун талаар сунаж тогтсон 80 километр орчим урт элсэн манхан юм. Төв зам энэ элсэн манханг хувааж байдаг бөгөөд өмнө хэсгийг нь Монгол элс, хойд талыг нь Хөгнө тарнын элс гэж нэрлэдэг. Тарнын голын нөлөөгөөр элсэн доороо чийгтэй байх бөгөөд бургас, хайлаас, яргай зэрэг бутлаг ургамал ургана. Эргэн тойронд нь жуулчны баазууд байрлах бөгөөд хойд талд нь Хөгнө хаан хэмээх үзэсгэлэнт сайхан уул, урд талд нь Их Монгол хэмээх Монгол орны хүйс цэгийг баримжаалах уул оршино.",,,https://drive.google.com/drive/folders/1Fr2SU1TLG7-BhbhycOp7cqvABzJ7UO-Z,https://drive.google.com/drive/folders/1Fr2SU1TLG7-BhbhycOp7cqvABzJ7UO-Z
1/27/2023 8:43:51,Sükhbaatar,Алтан Дарь овоо,,,"Алтан Овоо нь Сүхбаатар аймгийн нутагт Молцог элсний хойд захад Дарьганга сумын төвийн дэргэд оршдог 1354 м өндөр унтарсан галт уул. Мөн Дарь-Овоо, Алтан Дарь Овоо хэмээн нэрлэдэг.

Галт уулын шовгор хэлбэр нь эвдрээгүй үлдсэн. Галт уулсын хүрмэн чулуу их. Амсар нь баруун хойшоо сэтэрч урсчээ. Харьцангуй өндөр нь 100 м боловч аль ч талаасаа их алсаас (60км-ээс) сүр бараатай харагддаг сайхан галт уул. Алтан Овоо уулыг бүр 1700-аад оноос нутгийн тахилгатай болгосон бөгөөд 1913 оноос төрийн их тахилгатай болгосон Монголын их тахилгатай уулсын нэг юм. Энд орших хүн чулуудыг 1998 онд улсын хамгаалалтад авчээ. 2004 онд ерөнхийлөгчийн зарлигаар Дарь-Овоог төрийн тахилгат уул болгосон юм",,,https://drive.google.com/file/d/11bpCzgN-BQr7pTTHtouckcbM1ssD-LDl/view?usp=share_link,https://drive.google.com/file/d/1zHtc8SyIN7reJYhDIoZB14PidAnvLmSZ/view?usp=share_link
1/27/2023 8:44:32,Övörkhangai,УЛААН ЦУТГАЛАНГИЙН ХҮРХРЭЭ,올란초트갈랑 폭포 ,"울란바토르시에서 458km , 하르호롬시에서 132 km 떨어져 있다. 최고 관광지로 유명하다. 어르헝강에 합류하요 올란강에 20m 높이에서 물이 떨어지고 넓이가 10m 되느 폭포이다, 어르헝강은 갸트로 산맥부터 하르호롬 솜 까지 130km 거리에 화산용암 사이로 흐른다. 신생데 4기에 화산이 폭발해 마그마가 어르헝 유역을 따라 흘러 응고하였다.  ","Улаанбаатраас 458км зайтай Өвөрхангай аймгийн Бат-Өлзий суманд байрлах Улаан цутгалан хүрхрээ нь зуны дэлгэр цагт гадаад, дотоодын аялагч, жуулчдын үзэхийг хүсдэг хамгийн үзэсгэлэнтэй газрын нэг юм. Улаан цутгалангийн тухай домогт ийн өгүүлсэн байдаг. Дайны үед Монголын цэрэг гамингуудад хөөгдөж амь дүйж яваад хайрган дээгүүр гарсан гэнэ. Монгол цэргүүдийн нэг нь номтой гэх бөгөөд тэрээр “Улааны гол минь улаанаар урс” гэж дуу алдан орилоход, Улаан голын дагуу үер буун гамингийн цэргүүдийг аван одсон гэнэ. Хожим түүнээс хойш “Улаан цутгалан” гэж нэрлэх болжээ.Тэгээд тэр хүүрнүүд нэг хөндийд очин цугларсан бөгөөд тэр газрыг хүүртийн хөндий гэх бөгөөд олон жилийн явцад үүртийн хөндий болжээ.
Өвөрхангай аймгийн Орхон голын баруун биед цутгах Улаан голд үүссэн 20 гаруй метр өндрөөс буух 10 орчим метр өргөн хүрхрээ юм. Орхон гол нь Гятрууны нуруунаас Хархорин сум хүртэлх 130 километр газарт галт уулын хүрмэн чулуун дундуур урсдаг. Дөрөвдөгч галавын үед Хангайн нуруунаас эх авах Цагаан азарга голын эхэнд галт уул дэлбэрэн оргилж түүний халуун хайлмал бодис нь Орхоны хөндийг уруудан урсаж хэдэн арван км зузаан хүрмэн чулуун хучлага үүсгэжээ. Тэр хүрмэн чулуун хучлагыг Орхон гол хөрөөдөж урссаар таслан өнөөгийн энэ хавцлыг үүсгэсэн ажээ. Хүрхрээгээс баруун хойшоо Бага хүрхрээ гэж нэг боргио бий.",,,https://drive.google.com/drive/folders/1Fr2SU1TLG7-BhbhycOp7cqvABzJ7UO-Z,https://drive.google.com/drive/folders/1Fr2SU1TLG7-BhbhycOp7cqvABzJ7UO-Z
1/27/2023 8:46:02,Sükhbaatar,Шилийн богд,,,"Сүхбаатар аймгийн Дарьганга сумаас зүүн хойш 60 км-т д.т.дээш 1778 метрт оршдог Дарьгангын энэ өндөрлөг тэгш газарт 200 орчим унтарсан галт уул байдгийн хамгийн өндөр нь Шилийн Богд уул юм. Богд уул гэх нэршил нь сүүлд Буддын шашны нөлөөгөөр нэмэгдэж нэрлэгдсэн нэршил бөгөөд эрт дээр үеэс Монголчууд ""Шивээт шил"" ""Агшуун"" хэмээн нэрийддэг байсан ба тал нутгийн их хайрхан хэмээн тахин шүтэж иржээ.",,,https://drive.google.com/file/d/1alFN9xhUy4SfOUf_us9Mohj4AtOyhRC-/view?usp=share_link,https://drive.google.com/file/d/1hsnsDYVrxE8zflvsZuQJ570Zs2OwpIFz/view?usp=share_link
1/27/2023 8:46:46,Övörkhangai,ХҮЙСИЙН НАЙМАН НУУР,,,"Хүйсийн Найман нуур нь Өвөрхангай аймгийн төв Арвайхээр хотоос 115 км-т орших ба УБ хотоос аймгийн төв хүртэл 450 км байдаг. Зам маш бартаатай боловч жуулчид энэ бүсэд ихэвчлэн морь унаж баруун хойноос нь ирдэг. Хүйсийн Найман нуур нь Монгол орны төв хэсэг, Хангайн уулсын дунд д.т.д 2400 метрт оршдог. Тус газрын ихэнх хэсэг нь Өвөрхангай аймгийн Уянга сумын нутагт байх агаад баруун талаараа Бат-Өлзий сумтай хиллэдэг. Мөн Орхоны хөндийн байгалийн цогцолборт газрын нэг хэсэг болдог. Хойд талаараа галт уулын чулуулаг тархсан тал газраар хүрээлэгдсэн хүн ам сийрэг суурьшсан газар юм.
Ширээт, Халиут, Бугат, Хаяа, Хүйс, Мухар, Дөрөө, Баян-Уул хэмээн нэрлэгдсэн найман нуур байх бөгөөд хоорондоо газар доор усны судлаар холбогдсон байдаг. Нуурууд хоорондоо 500 метрээс 3 км хүртэл зайтай байдаг. 2007 оны байдлаар уг нууруудын 2 дахь том нуур Хүйсийн нуурын 10 % орчим нь ширгэж, 2 жижиг нуур нь бүрмөсөн ширгэсэн байна. Хүйсийн Найман нуур нь уулын тагийн бүслүүрийн хөрстэй, шилмүүст болон Сибирийн хар мод, хушин ойтой. Хойд талаараа галт уулын чулуулагтай тэгш тал, нүцгэн оройтой уулсаар хүрээлэгдсэн байдаг. Энэ бүсэд саарал чоно, халиун буга, зэрлэг гахай, тарвага, хэрэм, жирх, чандага, огдой зэрэг амьтад байдаг. 50 орчим төрлийн шувууд байдгаас Монголын улаан номонд орсон цасны хажир бүргэд, ухаа хажир бүргэд тэмдэглэгджээ.",,,https://drive.google.com/drive/folders/1Fr2SU1TLG7-BhbhycOp7cqvABzJ7UO-Z,https://drive.google.com/drive/folders/1Fr2SU1TLG7-BhbhycOp7cqvABzJ7UO-Z
1/27/2023 8:50:55,Övörkhangai,ҮҮРТИЙН ТОХОЙ,,,"Өвөрхангай аймгийн Бат-Өлзий сумын төвөөс зүүн хойш 18 километрт Улаанбаатар хотоос Орхоны хүрхрээ хүрэх зам дагуу бас нэгэн гайхамшигт ханан хад бүхий хавцлыг Үүртийн тохой гэдэг. Далайн түвшнээс дээш 1630 метр өндөрт. Энд дотрын өвчинд тустай нүүрсхүчлийн хий бүхий исгэлэн хүйтэн рашаан байдаг. Анх Хүүртийн тохой гэдэг нэртэй байсан бөгөөд Галдан хааны цэргүүд Өндөр гэгээн Занабазарыг барихаар Төвхөн хийдэд ирэх замд нь Орхон гол гэнэт үерлэн Галдан бошигтын цэргүүд олноороо усанд үйж үхэн. Үхсэн цэргүүдийн хүүр Үүртийн тохойд овоорон гарч ирсэн тул Хүүртийн тохой гэж нэрлэжээ. Энэ хэллэг сунжирсаар Үүртийн тохой болсон гэх. Энэ үйл явдлын дараа Манжийн хаан Өндөр гэгээн Занабазарыг аварсан Орхон голд “Түшээ гүн” цол олгож, Улаан цутгалангийн тогоонд жил бүр 100 лан цагаан мөнгө өргөж байх зарлиг гаргасан хэмээдэг. Орхон гол (түшээ гүн) нь Улаан эргийн тохойгоос Үүртийн тохой хүртэл тасралтгүй 10-25 метрийн өндөр хавцлаар 60 гаруй километр зам туулан урсдаг. Монгол орны хамгийн урт гол юм.",,,https://drive.google.com/drive/folders/1Fr2SU1TLG7-BhbhycOp7cqvABzJ7UO-Z,https://drive.google.com/drive/folders/1Fr2SU1TLG7-BhbhycOp7cqvABzJ7UO-Z
1/27/2023 8:58:05,Sükhbaatar,Монголын хүн чулууд,,," Сүхбаатар аймгийн Дариганга сумын төвийн зүүн хойно дөрвөн хүн чулуун хөшөө бий. Эдгээрийг нутгийн ард олон “ноён, хатан, хүү, бэр” хөрөг хэмээн нэрлэж хадаг тавин идээ, цагааныхаа дээжийг өргөж хүндэлсээр иржээ. Дурдсан хөргүүдийг анх 1927 онд Зөвлөлтийн судлаач В.А.Казакевич, Монголын эрдэмтэн, судлаач Н.Сэр-Оджав /1961 онд/, Д.Баяр /1981-1985 онд/ давтан судалж удаа дараа хэвлэн нийтэлсэн байна. Харьцуулсан судалгааны дүнд эдгээр хөрөг нь ХIII-ХIV зууны монголчуудын бүтээсэн дурсгал болох нь нэгэнт тогтоогджээ. ",,,https://drive.google.com/file/d/17NS6FhmlDwQIPa-43qmeLK2Lb9B5US1T/view?usp=share_link,https://drive.google.com/file/d/17_ZScRFNR8QhnlLT6emxvdrjSH70DIwo/view?usp=share_link
1/27/2023 9:01:17,Sükhbaatar,Ганга нуур,강가 호수 ,"수흐바타르 아이막 다르강가솜 중심지로부터 동남쪽으로 11km 떨어져 있는 곳에 있는 멀척 모래의 동북쪽 끝에 모래로 둘러쌓인 호수이다. 호수 크기는 4km2이고 작지만 담수호이다, 1993년에 강가호수를 포함한 32.860ha 지역을 국가에서 보호구역으로 지정하였다. 21개의 샘물이 이 호수에 합류하는데 그 중 닥싱샘이 제일 큰 역할을 하고 있다. 호수에서 50m 떨어져 있는 곳에 가는 모래알 밑에서 솟아오르는 샘으로 옆에서 소리가 커질수록 물이 확확 올라오는 특이한 샘이다. 그러나 안타깝게도 지구온난화와 사막화, 무분별한 광산개발로 강가호수는 매마를 위기에 처하고 있다. ","Ганга нуур нь Монгол Улсын Сүхбаатар аймгийн Дарьганга сумын нутагт орших, шорвог нуур юм. Хээр тал болон Говийн зааг дээр орших, ус намаг, элсэн манхан, хуурай хээр хосолсон өвөрмөц тогтоц бүхий тус нуур болон ойр орчмын намгархаг газар нь цэн тогоруу, хошуу галуу, хонин тоодог, гангар хун, хондон ангир зэрэг нүүдлийн ховор шувуудын чуулж, үрждэг чухал нутаг билээ.

Харамсалтай нь дэлхийн цаг уурын өөрчлөлтийн улмаас нуурын ус татарч, зарим жилүүдэд ширгэдэг болсон.

Ойр орчимд нь Дуут, Сүмтийн, Эрдэнэ, Холбоо, Зүүн Холбоо, Цагаан, Хосмогт, Улаан (ширгэсэн), Зэгст зэрэг нуур цөөрөм бий.

Ганга нуур, түүний орчмын ус, намгархаг газар нь 2004 онд Рамсарын ус, намгархаг газар болон бүртгэгджээ.",,,https://drive.google.com/file/d/1bPRhuXdX7NxoNPWXSi6wAPGh7S2Ai3og/view?usp=share_link,https://drive.google.com/file/d/1f9bnTlcSzXKJ1qhuQYeN5gllNBoAqFra/view?usp=share_link
